{
  "metadata": {
    "p": [
      0.5,
      0.25
    ],
    "u0": [
      0.99,
      0.01,
      0.0
    ],
    "tspan": [
      0.0,
      10000.0
    ]
  },
  "t": [
    0.0,
    0.09284972135797114,
    1.0213469349376825,
    4.730308099257948,
    10.228677689262607,
    18.31425261516454,
    27.82753051477629,
    37.199522058936026,
    43.77195890488725,
    50.34439575083847,
    57.34851443181673,
    64.42717783073053,
    71.96730511165129,
    80.42082880784326,
    90.40351386704342,
    102.75262015173696
  ],
  "u": [
    [
      0.99,
      0.9895352372107644,
      0.9842749739892699,
      0.9474778577502123,
      0.8111285685696914,
      0.4692702181050562,
      0.2718634256070777,
      0.2237105381717018,
      0.2138438719048309,
      0.21009771771207014,
      0.20861408640743825,
      0.2080777324610784,
      0.2078800876636019,
      0.20781024841788517,
      0.20778823424156034,
      0.20778263799851357
    ],
    [
      0.01,
      0.01022997899299957,
      0.012825206057771092,
      0.030572187075150636,
      0.08927463371470634,
      0.15736741584273783,
      0.07055669501889276,
      0.021022315049174553,
      0.008321134019081999,
      0.003227693264226679,
      0.0011672397559916443,
      0.0004163124271337634,
      0.0001387792007069591,
      4.0604932500547665e-05,
      9.647686788777695e-06,
      1.7771210413156543e-06
    ],
    [
      0.0,
      0.00023478379623604638,
      0.0028998199529591097,
      0.021949955174637145,
      0.09959679771560237,
      0.37336236605220613,
      0.6575798793740296,
      0.7552671467791238,
      0.7778349940760872,
      0.7866745890237034,
      0.7902186738365703,
      0.791505955111788,
      0.7919811331356913,
      0.7921491466496144,
      0.7922021180716511,
      0.7922155848804453
    ]
  ],
  "outputs": [
    0.7922155848804453,
    0.15742164632511513,
    18.119443842031806
  ]
}